{
  "verificationVersion": 1,
  "fixtureId": "p28-xdr-scval-u256-zero",
  "fixtureSha256": "05dde7ed22e0f5351fc573e23ddc8c87deb114b047a9ad3dd588f3a0336187d8",
  "method": "structural",
  "checkedAt": "2026-10-22T07:52:29Z",
  "verifier": {
    "name": "protocolcanary-fixtures-validate",
    "version": "89b05fdc479bcf482bbd9337024a5d45cac55544"
  },
  "outcome": "matched",
  "evidenceRef": null
}
