{
  "verificationVersion": 1,
  "fixtureId": "p28-xdr-scval-duration",
  "fixtureSha256": "dae7ef059eb8d0f5f52a81f3238fda600224305e091dabb8a790b93a224e788d",
  "method": "structural",
  "checkedAt": "2026-10-22T07:52:29Z",
  "verifier": {
    "name": "protocolcanary-fixtures-validate",
    "version": "89b05fdc479bcf482bbd9337024a5d45cac55544"
  },
  "outcome": "matched",
  "evidenceRef": null
}
