{
  "verificationVersion": 1,
  "fixtureId": "p28-xdr-ledger-entry-trustline-unknown-asset-type",
  "fixtureSha256": "0f07286d6ee38bdb8b71bf2faecd3fe09273d0c552fd794d0793c55c8f75f751",
  "method": "structural",
  "checkedAt": "2026-10-22T07:27:34Z",
  "verifier": {
    "name": "protocolcanary-fixtures-validate",
    "version": "2dfc7e9c5dc0ee93bb0f8e7fbb06c0042d7fcab9"
  },
  "outcome": "matched",
  "evidenceRef": null
}
