{
  "verificationVersion": 1,
  "fixtureId": "p28-xdr-scval-map-one",
  "fixtureSha256": "8f7f2cd3185d5a86afb51f5adf71f373e4cd12e483327d09fc587bf5526c18a0",
  "method": "structural",
  "checkedAt": "2026-10-22T07:46:50Z",
  "verifier": {
    "name": "protocolcanary-fixtures-validate",
    "version": "68026ed135bb234f7404d3ee27da0a3caab691da"
  },
  "outcome": "matched",
  "evidenceRef": null
}
