{
  "verificationVersion": 1,
  "fixtureId": "p28-xdr-contract-executable-wasm-decode-success",
  "fixtureSha256": "cc9ec76d7ee06af1bfe94ab3b476416121fbde8888841959cfba9b280e136438",
  "method": "structural",
  "checkedAt": "2026-10-22T07:52:29Z",
  "verifier": {
    "name": "protocolcanary-fixtures-validate",
    "version": "89b05fdc479bcf482bbd9337024a5d45cac55544"
  },
  "outcome": "matched",
  "evidenceRef": null
}
