{
  "verificationVersion": 1,
  "fixtureId": "p28-xdr-scval-bytes-empty",
  "fixtureSha256": "52d790551c3c58e0c72b3b79244e47b6e8b2e507d695b4b2a1faadacabc04238",
  "method": "structural",
  "checkedAt": "2026-10-22T07:52:29Z",
  "verifier": {
    "name": "protocolcanary-fixtures-validate",
    "version": "89b05fdc479bcf482bbd9337024a5d45cac55544"
  },
  "outcome": "matched",
  "evidenceRef": null
}
