{
  "verificationVersion": 1,
  "fixtureId": "p28-xdr-scval-i32-min",
  "fixtureSha256": "461425e61ef6330f1fdc19ffc51b19e8053144462a627e4b456d5701fbd46cf3",
  "method": "structural",
  "checkedAt": "2026-10-22T07:52:29Z",
  "verifier": {
    "name": "protocolcanary-fixtures-validate",
    "version": "89b05fdc479bcf482bbd9337024a5d45cac55544"
  },
  "outcome": "matched",
  "evidenceRef": null
}
