{
  "verificationVersion": 1,
  "fixtureId": "p28-xdr-scval-bool-true",
  "fixtureSha256": "eefacefd0f74b53553a8561865973b524698b29f7b307e6d30b0e2cee37cd775",
  "method": "structural",
  "checkedAt": "2026-10-22T07:52:29Z",
  "verifier": {
    "name": "protocolcanary-fixtures-validate",
    "version": "89b05fdc479bcf482bbd9337024a5d45cac55544"
  },
  "outcome": "matched",
  "evidenceRef": null
}
