{
  "verificationVersion": 1,
  "fixtureId": "p28-rpc-network",
  "fixtureSha256": "cd53626db9d7a130e678f90d7d32545c23c95895cc0eb3de71e44cd82fc9596d",
  "method": "structural",
  "checkedAt": "2026-10-22T07:27:34Z",
  "verifier": {
    "name": "protocolcanary-fixtures-validate",
    "version": "2dfc7e9c5dc0ee93bb0f8e7fbb06c0042d7fcab9"
  },
  "outcome": "matched",
  "evidenceRef": null
}
