{
  "verificationVersion": 1,
  "fixtureId": "p28-xdr-stellar-value-basic-decode-success",
  "fixtureSha256": "72422d5e6315f9a057008af7390081d10c717318d4e894fb874363362ac39ec9",
  "method": "structural",
  "checkedAt": "2026-10-22T07:46:50Z",
  "verifier": {
    "name": "protocolcanary-fixtures-validate",
    "version": "68026ed135bb234f7404d3ee27da0a3caab691da"
  },
  "outcome": "matched",
  "evidenceRef": null
}
