{
  "verificationVersion": 1,
  "fixtureId": "p28-xdr-ledger-entry-account-truncated",
  "fixtureSha256": "e4330e6324d2abfce7340631671719a8b95ed1739e69bab5136cda37adfb951f",
  "method": "structural",
  "checkedAt": "2026-10-22T07:27:34Z",
  "verifier": {
    "name": "protocolcanary-fixtures-validate",
    "version": "2dfc7e9c5dc0ee93bb0f8e7fbb06c0042d7fcab9"
  },
  "outcome": "matched",
  "evidenceRef": null
}
