{
  "verificationVersion": 1,
  "fixtureId": "p28-xdr-scval-map-multi",
  "fixtureSha256": "07a05fc18ca3fe4b9b9f60803991c9a9e10f90bf288eb9c93929bd7ed0da1822",
  "method": "structural",
  "checkedAt": "2026-10-22T07:52:29Z",
  "verifier": {
    "name": "protocolcanary-fixtures-validate",
    "version": "89b05fdc479bcf482bbd9337024a5d45cac55544"
  },
  "outcome": "matched",
  "evidenceRef": null
}
