{
  "verificationVersion": 1,
  "fixtureId": "p28-xdr-scval-string-small",
  "fixtureSha256": "46b43353ad226e663d7df948d831497dedf3b72431adef5ec04660feae20fe2e",
  "method": "structural",
  "checkedAt": "2026-10-22T07:52:29Z",
  "verifier": {
    "name": "protocolcanary-fixtures-validate",
    "version": "89b05fdc479bcf482bbd9337024a5d45cac55544"
  },
  "outcome": "matched",
  "evidenceRef": null
}
