{
  "verificationVersion": 1,
  "fixtureId": "p28-xdr-cap85-external-ref-roundtrip",
  "fixtureSha256": "68206b9f01591fa2fae87bae7b2a5c1365b50f7b9c784093beca8cb0ac788dc0",
  "method": "structural",
  "checkedAt": "2026-10-22T07:27:34Z",
  "verifier": {
    "name": "protocolcanary-fixtures-validate",
    "version": "2dfc7e9c5dc0ee93bb0f8e7fbb06c0042d7fcab9"
  },
  "outcome": "matched",
  "evidenceRef": null
}
