{
  "verificationVersion": 1,
  "fixtureId": "p28-xdr-scval-symbol-small",
  "fixtureSha256": "dc5910889a0210703cde4e906b1473eae796abc7334e638859ce65f5d9ae54d5",
  "method": "structural",
  "checkedAt": "2026-10-22T07:52:29Z",
  "verifier": {
    "name": "protocolcanary-fixtures-validate",
    "version": "89b05fdc479bcf482bbd9337024a5d45cac55544"
  },
  "outcome": "matched",
  "evidenceRef": null
}
