{
  "verificationVersion": 1,
  "fixtureId": "p28-xdr-transaction-envelope-v0-roundtrip",
  "fixtureSha256": "59b8935082da525ad14a8f63d8a3fb6108351046fd9e90bdf567f649b26db826",
  "method": "structural",
  "checkedAt": "2026-10-22T07:52:29Z",
  "verifier": {
    "name": "protocolcanary-fixtures-validate",
    "version": "89b05fdc479bcf482bbd9337024a5d45cac55544"
  },
  "outcome": "matched",
  "evidenceRef": null
}
