{
  "verificationVersion": 1,
  "fixtureId": "p28-xdr-scval-vec-null",
  "fixtureSha256": "406458b814f3bc732e5c709b4667aaba98ffad98a74f749a08dd4abaac8325f8",
  "method": "structural",
  "checkedAt": "2026-10-22T07:52:29Z",
  "verifier": {
    "name": "protocolcanary-fixtures-validate",
    "version": "89b05fdc479bcf482bbd9337024a5d45cac55544"
  },
  "outcome": "matched",
  "evidenceRef": null
}
