{
  "verificationVersion": 1,
  "fixtureId": "p28-xdr-ledger-entry-trustline-truncated",
  "fixtureSha256": "d1ad66e913cbfd06a0b19895de4332616863c05e94f24bc2d60f69d82b30ce20",
  "method": "structural",
  "checkedAt": "2026-10-22T07:27:34Z",
  "verifier": {
    "name": "protocolcanary-fixtures-validate",
    "version": "2dfc7e9c5dc0ee93bb0f8e7fbb06c0042d7fcab9"
  },
  "outcome": "matched",
  "evidenceRef": null
}
