{
  "verificationVersion": 1,
  "fixtureId": "p28-xdr-scval-address-contract",
  "fixtureSha256": "0c4156510d718450bb23542792a456d3bac5bdb6c907394d0588ced184531f1c",
  "method": "structural",
  "checkedAt": "2026-10-22T07:46:50Z",
  "verifier": {
    "name": "protocolcanary-fixtures-validate",
    "version": "68026ed135bb234f7404d3ee27da0a3caab691da"
  },
  "outcome": "matched",
  "evidenceRef": null
}
