{
  "verificationVersion": 1,
  "fixtureId": "p28-xdr-contract-executable-wasm-roundtrip",
  "fixtureSha256": "0b430092a7edc69fe272be58f1ce816e5c75c1d27cd6963942fff28f8c6a16d6",
  "method": "structural",
  "checkedAt": "2026-10-22T06:44:39Z",
  "verifier": {
    "name": "protocolcanary-fixtures-validate",
    "version": "eb90c66ca49451d6d672397bb0dd6e64de580db1"
  },
  "outcome": "matched",
  "evidenceRef": null
}
