{
  "verificationVersion": 1,
  "fixtureId": "p28-xdr-ledger-entry-trustline",
  "fixtureSha256": "86b63521e092e69864be1fcbae644cda4f117d7f9a8f84abd37d8bc334b3e3f3",
  "method": "structural",
  "checkedAt": "2026-10-22T07:46:50Z",
  "verifier": {
    "name": "protocolcanary-fixtures-validate",
    "version": "68026ed135bb234f7404d3ee27da0a3caab691da"
  },
  "outcome": "matched",
  "evidenceRef": null
}
