{
  "verificationVersion": 1,
  "fixtureId": "p28-xdr-contract-executable-stellar-asset-decode-success",
  "fixtureSha256": "687bcb3a38fcdc8e211a167de1db8e326515569c45aa7f6346288ceac3fb1472",
  "method": "structural",
  "checkedAt": "2026-10-22T07:46:50Z",
  "verifier": {
    "name": "protocolcanary-fixtures-validate",
    "version": "68026ed135bb234f7404d3ee27da0a3caab691da"
  },
  "outcome": "matched",
  "evidenceRef": null
}
